6-gram, count
of this project gutenberg ebook the, 2
this project gutenberg ebook the repairman, 2
start of this project gutenberg ebook, 1
produced by greg weeks susan carr, 1
by greg weeks susan carr and, 1
greg weeks susan carr and the, 1
weeks susan carr and the online, 1
distributed proofreading team at http www, 1
proofreading team at http www pgdp, 1
team at http www pgdp net, 1
being an interstellar trouble shooter wouldn, 1
an interstellar trouble shooter wouldn t, 1
interstellar trouble shooter wouldn t be, 1
trouble shooter wouldn t be so, 1
shooter wouldn t be so bad, 1
wouldn t be so bad if, 1
t be so bad if i, 1
the old man had that look, 1
old man had that look of, 1
man had that look of intense, 1
had that look of intense glee, 1
that look of intense glee on, 1
look of intense glee on his, 1
of intense glee on his face, 1
intense glee on his face that, 1
glee on his face that meant, 1
on his face that meant someone, 1
was in for a very rough, 1
in for a very rough time, 1
for a very rough time since, 1
a very rough time since we, 1
very rough time since we were, 1
rough time since we were alone, 1
time since we were alone it, 1
since we were alone it took, 1
we were alone it took no, 1
were alone it took no great, 1
alone it took no great feat, 1
of intelligence to figure it would, 1
intelligence to figure it would be, 1
to figure it would be me, 1
figure it would be me i, 1
it would be me i talked, 1
would be me i talked first, 1
be me i talked first bold, 1
me i talked first bold attack, 1
being the best defense and so, 1
the best defense and so forth, 1
i quit don t bother telling, 1
quit don t bother telling me, 1
don t bother telling me what, 1
t bother telling me what dirty, 1
bother telling me what dirty job, 1
telling me what dirty job you, 1
me what dirty job you have, 1
what dirty job you have cooked, 1
dirty job you have cooked up, 1
because i have already quit and, 1
i have already quit and you, 1
have already quit and you do, 1
already quit and you do not, 1
quit and you do not want, 1
and you do not want to, 1
you do not want to reveal, 1
do not want to reveal company, 1
the grin was even wider now, 1
grin was even wider now and, 1
was even wider now and he, 1
even wider now and he actually, 1
wider now and he actually chortled, 1
now and he actually chortled as, 1
and he actually chortled as he, 1
he actually chortled as he thumbed, 1
actually chortled as he thumbed a, 1
button on his console a thick, 1
on his console a thick legal, 1
his console a thick legal document, 1
console a thick legal document slid, 1
a thick legal document slid out, 1
thick legal document slid out of, 1
legal document slid out of the, 1
document slid out of the delivery, 1
this is your contract he said, 1
is your contract he said it, 1
your contract he said it tells, 1
contract he said it tells how, 1
he said it tells how and, 1
said it tells how and when, 1
it tells how and when you, 1
tells how and when you will, 1
how and when you will work, 1
a steel and vanadium bound contract, 1
steel and vanadium bound contract that, 1
and vanadium bound contract that you, 1
vanadium bound contract that you couldn, 1
bound contract that you couldn t, 1
contract that you couldn t crack, 1
that you couldn t crack with, 1
you couldn t crack with a, 1
i leaned out quickly grabbed it, 1
leaned out quickly grabbed it and, 1
out quickly grabbed it and threw, 1
quickly grabbed it and threw it, 1
grabbed it and threw it into, 1
it and threw it into the, 1
and threw it into the air, 1
threw it into the air with, 1
it into the air with a, 1
into the air with a single, 1
motion before it could fall i, 1
before it could fall i had, 1
it could fall i had my, 1
could fall i had my solar, 1
fall i had my solar out, 1
i had my solar out and, 1
had my solar out and with, 1
my solar out and with a, 1
solar out and with a wide, 1
out and with a wide angle, 1
shot burned the contract to ashes, 1
the old man pressed the button, 1
old man pressed the button again, 1
man pressed the button again and, 1
pressed the button again and another, 1
the button again and another contract, 1
button again and another contract slid, 1
again and another contract slid out, 1
and another contract slid out on, 1
his desk if possible the smile, 1
desk if possible the smile was, 1
if possible the smile was still, 1
possible the smile was still wider, 1
the smile was still wider now, 1
i should have said a duplicate, 1
should have said a duplicate of, 1
have said a duplicate of your, 1
said a duplicate of your contract, 1
a duplicate of your contract like, 1
duplicate of your contract like this, 1
of your contract like this one, 1
your contract like this one here, 1
he made a quick note on, 1
made a quick note on his, 1
a quick note on his secretary, 1
quick note on his secretary plate, 1
note on his secretary plate i, 1
on his secretary plate i have, 1
his secretary plate i have deducted, 1
secretary plate i have deducted credits, 1
from your salary for the cost, 1
your salary for the cost of, 1
salary for the cost of the, 1
for the cost of the duplicate, 1
the cost of the duplicate as, 1
cost of the duplicate as well, 1
of the duplicate as well as, 1
the duplicate as well as a, 1
duplicate as well as a credit, 1
fine for firing a solar inside, 1
for firing a solar inside a, 1
firing a solar inside a building, 1
i slumped defeated waiting for the, 1
slumped defeated waiting for the blow, 1
defeated waiting for the blow to, 1
waiting for the blow to land, 1
for the blow to land the, 1
the blow to land the old, 1
blow to land the old man, 1
to land the old man fondled, 1
according to this document you can, 1
to this document you can t, 1
this document you can t quit, 1
document you can t quit ever, 1
you can t quit ever therefore, 1
can t quit ever therefore i, 1
t quit ever therefore i have, 1
quit ever therefore i have a, 1
little job i know you ll, 1
job i know you ll enjoy, 1
i know you ll enjoy repair, 1
know you ll enjoy repair job, 1
you ll enjoy repair job the, 1
ll enjoy repair job the centauri, 1
enjoy repair job the centauri beacon, 1
repair job the centauri beacon has, 1
job the centauri beacon has shut, 1
down it s a mark iii, 1
it s a mark iii beacon, 1
what kind of beacon i asked, 1
kind of beacon i asked him, 1
of beacon i asked him i, 1
beacon i asked him i have, 1
i asked him i have repaired, 1
asked him i have repaired hyperspace, 1
him i have repaired hyperspace beacons, 1
from one arm of the galaxy, 1
one arm of the galaxy to, 1
arm of the galaxy to the, 1
of the galaxy to the other, 1
the galaxy to the other and, 1
galaxy to the other and was, 1
to the other and was sure, 1
the other and was sure i, 1
other and was sure i had, 1
and was sure i had worked, 1
was sure i had worked on, 1
every type or model made but, 1
type or model made but i, 1
or model made but i had, 1
model made but i had never, 1
made but i had never heard, 1
but i had never heard of, 1
i had never heard of this, 1
had never heard of this kind, 1
mark iii the old man repeated, 1
iii the old man repeated practically, 1
the old man repeated practically chortling, 1
old man repeated practically chortling i, 1
man repeated practically chortling i never, 1
repeated practically chortling i never heard, 1
of it either until records dug, 1
it either until records dug up, 1
either until records dug up the, 1
until records dug up the specs, 1
records dug up the specs they, 1
dug up the specs they found, 1
up the specs they found them, 1
the specs they found them buried, 1
specs they found them buried in, 1
the back of their oldest warehouse, 1
back of their oldest warehouse this, 1
of their oldest warehouse this was, 1
their oldest warehouse this was the, 1
oldest warehouse this was the earliest, 1
warehouse this was the earliest type, 1
this was the earliest type of, 1
was the earliest type of beacon, 1
ever built by earth no less, 1
built by earth no less considering, 1
by earth no less considering its, 1
earth no less considering its location, 1
no less considering its location on, 1
less considering its location on one, 1
considering its location on one of, 1
its location on one of the, 1
proxima centauri planets it might very, 1
centauri planets it might very well, 1
planets it might very well be, 1
it might very well be the, 1
might very well be the first, 1
very well be the first beacon, 1
i looked at the blueprints he, 1
looked at the blueprints he handed, 1
at the blueprints he handed me, 1
the blueprints he handed me and, 1
blueprints he handed me and felt, 1
he handed me and felt my, 1
handed me and felt my eyes, 1
me and felt my eyes glaze, 1
and felt my eyes glaze with, 1
horror it s a monstrosity it, 1
it s a monstrosity it looks, 1
s a monstrosity it looks more, 1
a monstrosity it looks more like, 1
monstrosity it looks more like a, 1
it looks more like a distillery, 1
looks more like a distillery than, 1
more like a distillery than a, 1
beacon must be at least a, 1
must be at least a few, 1
be at least a few hundred, 1
at least a few hundred meters, 1
least a few hundred meters high, 1
a few hundred meters high i, 1
few hundred meters high i m, 1
hundred meters high i m a, 1
meters high i m a repairman, 1
high i m a repairman not, 1
an archeologist this pile of junk, 1
archeologist this pile of junk is, 1
this pile of junk is over, 1
pile of junk is over years, 1
of junk is over years old, 1
junk is over years old just, 1
is over years old just forget, 1
about it and build a new, 1
it and build a new one, 1
the old man leaned over his, 1
old man leaned over his desk, 1
man leaned over his desk breathing, 1
leaned over his desk breathing into, 1
over his desk breathing into my, 1
his desk breathing into my face, 1
desk breathing into my face it, 1
breathing into my face it would, 1
into my face it would take, 1
a year to install a new, 1
year to install a new beacon, 1
to install a new beacon besides, 1
install a new beacon besides being, 1
a new beacon besides being too, 1
new beacon besides being too expensive, 1
beacon besides being too expensive and, 1
besides being too expensive and this, 1
relic is on one of the, 1
is on one of the main, 1
on one of the main routes, 1
one of the main routes we, 1
of the main routes we have, 1
the main routes we have ships, 1
main routes we have ships making, 1
he leaned back wiped his hands, 1
leaned back wiped his hands on, 1
back wiped his hands on his, 1
wiped his hands on his handkerchief, 1
his hands on his handkerchief and, 1
hands on his handkerchief and gave, 1
on his handkerchief and gave me, 1
his handkerchief and gave me lecture, 1
forty four on company duty and, 1
four on company duty and my, 1
on company duty and my troubles, 1
this department is officially called maintenance, 1
department is officially called maintenance and, 1
is officially called maintenance and repair, 1
officially called maintenance and repair when, 1
called maintenance and repair when it, 1
really should be called trouble shooting, 1
should be called trouble shooting hyperspace, 1
be called trouble shooting hyperspace beacons, 1
called trouble shooting hyperspace beacons are, 1
trouble shooting hyperspace beacons are made, 1
shooting hyperspace beacons are made to, 1
last forever or damn close to, 1
forever or damn close to it, 1
or damn close to it when, 1
damn close to it when one, 1
close to it when one of, 1
to it when one of them, 1
it when one of them breaks, 1
when one of them breaks down, 1
one of them breaks down it, 1
of them breaks down it is, 1
never an accident and repairing the, 1
an accident and repairing the thing, 1
accident and repairing the thing is, 1
and repairing the thing is never, 1
repairing the thing is never a, 1
the thing is never a matter, 1
thing is never a matter of, 1
is never a matter of just, 1
he was telling me the guy, 1
was telling me the guy who, 1
telling me the guy who did, 1
me the guy who did the, 1
the guy who did the job, 1
guy who did the job while, 1
who did the job while he, 1
did the job while he sat, 1
the job while he sat back, 1
job while he sat back on, 1
while he sat back on his, 1
fat paycheck in an air conditioned, 1
paycheck in an air conditioned office, 1
he rambled on how i wish, 1
rambled on how i wish that, 1
on how i wish that were, 1
how i wish that were all, 1
i wish that were all it, 1
wish that were all it took, 1
that were all it took i, 1
were all it took i would, 1
all it took i would have, 1
it took i would have a, 1
took i would have a fleet, 1
of parts ships and junior mechanics, 1
parts ships and junior mechanics to, 1
ships and junior mechanics to install, 1
and junior mechanics to install them, 1
junior mechanics to install them but, 1
mechanics to install them but its, 1
to install them but its not, 1
install them but its not like, 1
that at all i have a, 1
at all i have a fleet, 1
all i have a fleet of, 1
i have a fleet of expensive, 1
have a fleet of expensive ships, 1
a fleet of expensive ships that, 1
fleet of expensive ships that are, 1
of expensive ships that are equipped, 1
expensive ships that are equipped to, 1
ships that are equipped to do, 1
almost anything manned by a bunch, 1
anything manned by a bunch of, 1
manned by a bunch of irresponsibles, 1
by a bunch of irresponsibles like, 1
a bunch of irresponsibles like you, 1
i nodded moodily at his pointing, 1
nodded moodily at his pointing finger, 1
how i wish i could fire, 1
i wish i could fire you, 1
wish i could fire you all, 1
i could fire you all combination, 1
could fire you all combination space, 1
fire you all combination space jockeys, 1
you all combination space jockeys mechanics, 1
engineers soldiers con men and anything, 1
soldiers con men and anything else, 1
con men and anything else it, 1
men and anything else it takes, 1
and anything else it takes to, 1
anything else it takes to do, 1
else it takes to do the, 1
repairs i have to browbeat bribe, 1
i have to browbeat bribe blackmail, 1
have to browbeat bribe blackmail and, 1
to browbeat bribe blackmail and bulldoze, 1
browbeat bribe blackmail and bulldoze you, 1
bribe blackmail and bulldoze you thugs, 1
into doing a simple job if, 1
doing a simple job if you, 1
a simple job if you think, 1
simple job if you think you, 1
job if you think you re, 1
if you think you re fed, 1
you think you re fed up, 1
think you re fed up just, 1
you re fed up just think, 1
re fed up just think how, 1
fed up just think how i, 1
feel but the ships must go, 1
but the ships must go through, 1
the ships must go through the, 1
ships must go through the beacons, 1
must go through the beacons must, 1
go through the beacons must operate, 1
i recognized this deathless line as, 1
recognized this deathless line as the, 1
this deathless line as the curtain, 1
deathless line as the curtain speech, 1
line as the curtain speech and, 1
as the curtain speech and crawled, 1
the curtain speech and crawled to, 1
curtain speech and crawled to my, 1
feet he threw the mark iii, 1
he threw the mark iii file, 1
threw the mark iii file at, 1
the mark iii file at me, 1
mark iii file at me and, 1
iii file at me and went, 1
file at me and went back, 1
at me and went back to, 1
me and went back to scratching, 1
and went back to scratching in, 1
his papers just as i reached, 1
papers just as i reached the, 1
just as i reached the door, 1
as i reached the door he, 1
i reached the door he looked, 1
reached the door he looked up, 1
the door he looked up and, 1
door he looked up and impaled, 1
he looked up and impaled me, 1
looked up and impaled me on, 1
and don t get any fancy, 1
don t get any fancy ideas, 1
t get any fancy ideas about, 1
get any fancy ideas about jumping, 1
any fancy ideas about jumping your, 1
fancy ideas about jumping your contract, 1
ideas about jumping your contract we, 1
about jumping your contract we can, 1
attach that bank account of yours, 1
that bank account of yours on, 1
bank account of yours on algol, 1
account of yours on algol ii, 1
of yours on algol ii long, 1
yours on algol ii long before, 1
on algol ii long before you, 1
algol ii long before you could, 1
ii long before you could draw, 1
i smiled a little weakly i, 1
smiled a little weakly i m, 1
a little weakly i m afraid, 1
little weakly i m afraid as, 1
weakly i m afraid as if, 1
i m afraid as if i, 1
m afraid as if i had, 1
afraid as if i had never, 1
as if i had never meant, 1
if i had never meant to, 1
i had never meant to keep, 1
that account a secret his spies, 1
account a secret his spies were, 1
a secret his spies were getting, 1
secret his spies were getting more, 1
his spies were getting more efficient, 1
spies were getting more efficient every, 1
were getting more efficient every day, 1
walking down the hall i tried, 1
down the hall i tried to, 1
the hall i tried to figure, 1
hall i tried to figure a, 1
i tried to figure a way, 1
tried to figure a way to, 1
to figure a way to transfer, 1
figure a way to transfer the, 1
a way to transfer the money, 1
without his catching on and knew, 1
his catching on and knew at, 1
catching on and knew at the, 1
on and knew at the same, 1
and knew at the same time, 1
knew at the same time he, 1
at the same time he was, 1
the same time he was figuring, 1
same time he was figuring a, 1
time he was figuring a way, 1
it was all very depressing so, 1
was all very depressing so i, 1
all very depressing so i stopped, 1
very depressing so i stopped for, 1
depressing so i stopped for a, 1
so i stopped for a drink, 1
i stopped for a drink then, 1
stopped for a drink then went, 1
for a drink then went on, 1
a drink then went on to, 1
by the time the ship was, 1
the time the ship was serviced, 1
time the ship was serviced i, 1
the ship was serviced i had, 1
ship was serviced i had a, 1
was serviced i had a course, 1
serviced i had a course charted, 1
i had a course charted the, 1
had a course charted the nearest, 1
beacon to the broken down proxima, 1
to the broken down proxima centauri, 1
the broken down proxima centauri beacon, 1
broken down proxima centauri beacon was, 1
down proxima centauri beacon was on, 1
proxima centauri beacon was on one, 1
centauri beacon was on one of, 1
beacon was on one of the, 1
planets of beta circinus and i, 1
of beta circinus and i headed, 1
beta circinus and i headed there, 1
circinus and i headed there first, 1
and i headed there first a, 1
i headed there first a short, 1
headed there first a short trip, 1
there first a short trip of, 1
first a short trip of only, 1
to understand the importance of the, 1
understand the importance of the beacons, 1
the importance of the beacons you, 1
importance of the beacons you have, 1
of the beacons you have to, 1
the beacons you have to understand, 1
hyperspace not that many people do, 1
not that many people do but, 1
that many people do but it, 1
many people do but it is, 1
people do but it is easy, 1
do but it is easy enough, 1
but it is easy enough to, 1
it is easy enough to understand, 1
that in this non space the, 1
in this non space the regular, 1
this non space the regular rules, 1
non space the regular rules don, 1
space the regular rules don t, 1
the regular rules don t apply, 1
regular rules don t apply speed, 1
rules don t apply speed and, 1
measurements are a matter of relationship, 1
are a matter of relationship not, 1
a matter of relationship not constant, 1
matter of relationship not constant facts, 1
of relationship not constant facts like, 1
relationship not constant facts like the, 1
the first ships to enter hyperspace, 1
first ships to enter hyperspace had, 1
ships to enter hyperspace had no, 1
to enter hyperspace had no place, 1
enter hyperspace had no place to, 1
hyperspace had no place to go, 1
had no place to go and, 1
no place to go and no, 1
place to go and no way, 1
to go and no way to, 1
even tell if they had moved, 1
tell if they had moved the, 1
if they had moved the beacons, 1
they had moved the beacons solved, 1
had moved the beacons solved that, 1
moved the beacons solved that problem, 1
the beacons solved that problem and, 1
beacons solved that problem and opened, 1
the entire universe they are built, 1
entire universe they are built on, 1
universe they are built on planets, 1
they are built on planets and, 1
are built on planets and generate, 1
built on planets and generate tremendous, 1
amounts of power this power is, 1
of power this power is turned, 1
power this power is turned into, 1
this power is turned into radiation, 1
power is turned into radiation that, 1
is turned into radiation that is, 1
turned into radiation that is punched, 1
through into hyperspace every beacon has, 1
into hyperspace every beacon has a, 1
hyperspace every beacon has a code, 1
every beacon has a code signal, 1
beacon has a code signal as, 1
has a code signal as part, 1
a code signal as part of, 1
code signal as part of its, 1
radiation and represents a measurable point, 1
and represents a measurable point in, 1
represents a measurable point in hyperspace, 1
a measurable point in hyperspace triangulation, 1
and quadrature of the beacons works, 1
quadrature of the beacons works for, 1
of the beacons works for navigation, 1
the beacons works for navigation only, 1
beacons works for navigation only it, 1
works for navigation only it follows, 1
for navigation only it follows its, 1
own rules the rules are complex, 1
rules the rules are complex and, 1
the rules are complex and variable, 1
rules are complex and variable but, 1
are complex and variable but they, 1
complex and variable but they are, 1
and variable but they are still, 1
variable but they are still rules, 1
for a hyperspace jump you need, 1
a hyperspace jump you need at, 1
hyperspace jump you need at least, 1
jump you need at least four, 1
you need at least four beacons, 1
need at least four beacons for, 1
at least four beacons for an, 1
least four beacons for an accurate, 1
fix for long jumps navigators use, 1
for long jumps navigators use as, 1
long jumps navigators use as many, 1
jumps navigators use as many as, 1
navigators use as many as seven, 1
use as many as seven or, 1
as many as seven or eight, 1
many as seven or eight so, 1
as seven or eight so every, 1
beacon is important and every one, 1
is important and every one has, 1
important and every one has to, 1
and every one has to keep, 1
every one has to keep operating, 1
one has to keep operating that, 1
has to keep operating that is, 1
to keep operating that is where, 1
keep operating that is where i, 1
and the other trouble shooters came, 1
the other trouble shooters came in, 1
we travel in well stocked ships, 1
travel in well stocked ships that, 1
in well stocked ships that carry, 1
well stocked ships that carry a, 1
stocked ships that carry a little, 1
ships that carry a little bit, 1
that carry a little bit of, 1
carry a little bit of everything, 1
only one man to a ship, 1
one man to a ship because, 1
man to a ship because that, 1
to a ship because that is, 1
a ship because that is all, 1
ship because that is all it, 1
because that is all it takes, 1
that is all it takes to, 1
is all it takes to operate, 1
all it takes to operate the, 1
overly efficient repair machinery due to, 1
efficient repair machinery due to the, 1
repair machinery due to the very, 1
machinery due to the very nature, 1
due to the very nature of, 1
to the very nature of our, 1
the very nature of our job, 1
very nature of our job we, 1
spend most of our time just, 1
most of our time just rocketing, 1
of our time just rocketing through, 1
our time just rocketing through normal, 1
time just rocketing through normal space, 1
just rocketing through normal space after, 1
rocketing through normal space after all, 1
when a beacon breaks down how, 1
a beacon breaks down how do, 1
beacon breaks down how do you, 1
breaks down how do you find, 1
down how do you find it, 1
not through hyperspace all you can, 1
through hyperspace all you can do, 1
hyperspace all you can do is, 1
all you can do is approach, 1
you can do is approach as, 1
can do is approach as close, 1
do is approach as close as, 1
is approach as close as you, 1
approach as close as you can, 1
by using other beacons then finish, 1
using other beacons then finish the, 1
other beacons then finish the trip, 1
beacons then finish the trip in, 1
then finish the trip in normal, 1
finish the trip in normal space, 1
the trip in normal space this, 1
trip in normal space this can, 1
this job didn t turn out, 1
job didn t turn out to, 1
didn t turn out to be, 1
t turn out to be quite, 1
turn out to be quite that, 1
out to be quite that bad, 1
to be quite that bad i, 1
be quite that bad i zeroed, 1
quite that bad i zeroed on, 1
that bad i zeroed on the, 1
bad i zeroed on the beta, 1
circinus beacon and ran a complicated, 1
beacon and ran a complicated eight, 1
and ran a complicated eight point, 1
ran a complicated eight point problem, 1
a complicated eight point problem through, 1
complicated eight point problem through the, 1
navigator using every beacon i could, 1
using every beacon i could get, 1
every beacon i could get an, 1
beacon i could get an accurate, 1
i could get an accurate fix, 1
could get an accurate fix on, 1
get an accurate fix on the, 1
computer gave me a course with, 1
gave me a course with an, 1
me a course with an estimated, 1
a course with an estimated point, 1
course with an estimated point of, 1
with an estimated point of arrival, 1
an estimated point of arrival as, 1
estimated point of arrival as well, 1
point of arrival as well as, 1
a built in safety factor i, 1
built in safety factor i never, 1
in safety factor i never could, 1
safety factor i never could eliminate, 1
factor i never could eliminate from, 1
i never could eliminate from the, 1
never could eliminate from the machine, 1
i would much rather take a, 1
would much rather take a chance, 1
much rather take a chance of, 1
rather take a chance of breaking, 1
take a chance of breaking through, 1
a chance of breaking through near, 1
