6-gram, count
not really from paradise i had, 1
really from paradise i had lifted, 1
from paradise i had lifted it, 1
paradise i had lifted it from, 1
i had lifted it from the, 1
had lifted it from the treasury, 1
lifted it from the treasury the, 1
it from the treasury the night, 1
before come back tomorrow and we, 1
come back tomorrow and we will, 1
back tomorrow and we will talk, 1
tomorrow and we will talk some, 1
and we will talk some more, 1
we will talk some more i, 1
will talk some more i called, 1
talk some more i called after, 1
the fleeing figure i was pleased, 1
fleeing figure i was pleased to, 1
figure i was pleased to notice, 1
i was pleased to notice that, 1
was pleased to notice that he, 1
pleased to notice that he took, 1
to notice that he took the, 1
notice that he took the cash, 1
that he took the cash before, 1
after that grandpa in paradise had, 1
that grandpa in paradise had many, 1
grandpa in paradise had many heart, 1
in paradise had many heart to, 1
paradise had many heart to heart, 1
had many heart to heart talks, 1
many heart to heart talks with, 1
grandson who found the heavenly loot, 1
who found the heavenly loot more, 1
found the heavenly loot more than, 1
the heavenly loot more than he, 1
heavenly loot more than he could, 1
loot more than he could resist, 1
more than he could resist grandpa, 1
had been out of touch with, 1
been out of touch with things, 1
out of touch with things since, 1
of touch with things since his, 1
touch with things since his death, 1
with things since his death and, 1
things since his death and goat, 1
since his death and goat boy, 1
his death and goat boy happily, 1
i learned all i needed to, 1
learned all i needed to know, 1
all i needed to know of, 1
i needed to know of the, 1
needed to know of the history, 1
to know of the history past, 1
know of the history past and, 1
of the history past and recent, 1
the history past and recent and, 1
history past and recent and it, 1
in addition to the pyramid being, 1
addition to the pyramid being around, 1
to the pyramid being around the, 1
the pyramid being around the beacon, 1
pyramid being around the beacon there, 1
being around the beacon there was, 1
around the beacon there was a, 1
the beacon there was a nice, 1
little religious war going on around, 1
religious war going on around the, 1
war going on around the pyramid, 1
it all began with the land, 1
all began with the land bridge, 1
began with the land bridge apparently, 1
with the land bridge apparently the, 1
the land bridge apparently the local, 1
land bridge apparently the local lizards, 1
bridge apparently the local lizards had, 1
apparently the local lizards had been, 1
living in the swamps when the, 1
in the swamps when the beacon, 1
the swamps when the beacon was, 1
swamps when the beacon was built, 1
when the beacon was built but, 1
the beacon was built but the, 1
beacon was built but the builders, 1
was built but the builders didn, 1
built but the builders didn t, 1
think much of them they were, 1
much of them they were a, 1
of them they were a low, 1
them they were a low type, 1
they were a low type and, 1
were a low type and confined, 1
a low type and confined to, 1
low type and confined to a, 1
type and confined to a distant, 1
continent the idea that the race, 1
the idea that the race would, 1
idea that the race would develop, 1
that the race would develop and, 1
the race would develop and might, 1
race would develop and might reach, 1
would develop and might reach this, 1
continent never occurred to the beacon, 1
never occurred to the beacon mechanics, 1
occurred to the beacon mechanics which, 1
to the beacon mechanics which is, 1
the beacon mechanics which is of, 1
beacon mechanics which is of course, 1
a little geological turnover a swampy, 1
little geological turnover a swampy land, 1
geological turnover a swampy land bridge, 1
turnover a swampy land bridge formed, 1
a swampy land bridge formed in, 1
swampy land bridge formed in the, 1
land bridge formed in the right, 1
spot and the lizards began to, 1
and the lizards began to wander, 1
the lizards began to wander up, 1
lizards began to wander up beacon, 1
began to wander up beacon valley, 1
to wander up beacon valley and, 1
wander up beacon valley and found, 1
religion a shiny metal temple out, 1
a shiny metal temple out of, 1
shiny metal temple out of which, 1
metal temple out of which poured, 1
temple out of which poured a, 1
out of which poured a constant, 1
of which poured a constant stream, 1
which poured a constant stream of, 1
magic water the reactor cooling water, 1
water the reactor cooling water pumped, 1
the reactor cooling water pumped down, 1
reactor cooling water pumped down from, 1
cooling water pumped down from the, 1
water pumped down from the atmosphere, 1
condenser on the roof the radioactivity, 1
on the roof the radioactivity in, 1
the roof the radioactivity in the, 1
roof the radioactivity in the water, 1
the radioactivity in the water didn, 1
radioactivity in the water didn t, 1
in the water didn t hurt, 1
the water didn t hurt the, 1
natives it caused mutations that bred, 1
it caused mutations that bred true, 1
a city was built around the, 1
city was built around the temple, 1
was built around the temple and, 1
built around the temple and through, 1
around the temple and through the, 1
the temple and through the centuries, 1
temple and through the centuries the, 1
pyramid was put up around the, 1
was put up around the beacon, 1
put up around the beacon a, 1
up around the beacon a special, 1
around the beacon a special branch, 1
the beacon a special branch of, 1
beacon a special branch of the, 1
a special branch of the priesthood, 1
served the temple all went well, 1
the temple all went well until, 1
temple all went well until one, 1
all went well until one of, 1
went well until one of the, 1
well until one of the priests, 1
until one of the priests violated, 1
one of the priests violated the, 1
temple and destroyed the holy waters, 1
and destroyed the holy waters there, 1
destroyed the holy waters there had, 1
the holy waters there had been, 1
holy waters there had been revolt, 1
waters there had been revolt strife, 1
murder and destruction since then but, 1
and destruction since then but still, 1
destruction since then but still the, 1
since then but still the holy, 1
then but still the holy waters, 1
but still the holy waters would, 1
still the holy waters would not, 1
flow now armed mobs fought around, 1
now armed mobs fought around the, 1
armed mobs fought around the temple, 1
mobs fought around the temple each, 1
fought around the temple each day, 1
around the temple each day and, 1
the temple each day and a, 1
temple each day and a new, 1
each day and a new band, 1
day and a new band of, 1
and i had to walk into, 1
i had to walk into the, 1
had to walk into the middle, 1
to walk into the middle of, 1
walk into the middle of that, 1
into the middle of that mess, 1
the middle of that mess and, 1
middle of that mess and repair, 1
of that mess and repair the, 1
that mess and repair the thing, 1
it would have been easy enough, 1
would have been easy enough if, 1
have been easy enough if we, 1
been easy enough if we were, 1
easy enough if we were allowed, 1
enough if we were allowed a, 1
if we were allowed a little, 1
we were allowed a little mayhem, 1
were allowed a little mayhem i, 1
could have had a lizard fry, 1
have had a lizard fry fixed, 1
had a lizard fry fixed the, 1
a lizard fry fixed the beacon, 1
lizard fry fixed the beacon and, 1
fry fixed the beacon and taken, 1
fixed the beacon and taken off, 1
the beacon and taken off only, 1
native life forms were quite well, 1
life forms were quite well protected, 1
forms were quite well protected there, 1
were quite well protected there were, 1
quite well protected there were spy, 1
well protected there were spy cells, 1
protected there were spy cells on, 1
my ship all of which i, 1
ship all of which i hadn, 1
all of which i hadn t, 1
of which i hadn t found, 1
which i hadn t found that, 1
i hadn t found that would, 1
hadn t found that would cheerfully, 1
t found that would cheerfully rat, 1
found that would cheerfully rat on, 1
that would cheerfully rat on me, 1
diplomacy was called for i sighed, 1
was called for i sighed and, 1
called for i sighed and dragged, 1
for i sighed and dragged out, 1
i sighed and dragged out the, 1
sighed and dragged out the plastiflesh, 1
working from d snaps of grandson, 1
from d snaps of grandson i, 1
d snaps of grandson i modeled, 1
snaps of grandson i modeled a, 1
of grandson i modeled a passable, 1
grandson i modeled a passable reptile, 1
i modeled a passable reptile head, 1
over my own features it was, 1
my own features it was a, 1
own features it was a little, 1
features it was a little short, 1
it was a little short in, 1
was a little short in the, 1
a little short in the jaw, 1
little short in the jaw me, 1
short in the jaw me not, 1
in the jaw me not having, 1
one of their toothy mandibles but, 1
of their toothy mandibles but that, 1
their toothy mandibles but that was, 1
toothy mandibles but that was all, 1
mandibles but that was all right, 1
but that was all right i, 1
that was all right i didn, 1
was all right i didn t, 1
all right i didn t have, 1
right i didn t have to, 1
look exactly like them just something, 1
exactly like them just something close, 1
like them just something close to, 1
them just something close to soothe, 1
just something close to soothe the, 1
something close to soothe the native, 1
mind it s logical if i, 1
it s logical if i were, 1
s logical if i were an, 1
logical if i were an ignorant, 1
if i were an ignorant aborigine, 1
i were an ignorant aborigine of, 1
were an ignorant aborigine of earth, 1
an ignorant aborigine of earth and, 1
ignorant aborigine of earth and i, 1
aborigine of earth and i ran, 1
into a spican who looks like, 1
a spican who looks like a, 1
spican who looks like a two, 1
who looks like a two foot, 1
looks like a two foot gob, 1
like a two foot gob of, 1
a two foot gob of dried, 1
two foot gob of dried shellac, 1
foot gob of dried shellac i, 1
gob of dried shellac i would, 1
immediately leave the scene however if, 1
leave the scene however if the, 1
the scene however if the spican, 1
scene however if the spican was, 1
however if the spican was wearing, 1
if the spican was wearing a, 1
the spican was wearing a suit, 1
of plastiflesh that looked remotely humanoid, 1
plastiflesh that looked remotely humanoid i, 1
that looked remotely humanoid i would, 1
looked remotely humanoid i would at, 1
remotely humanoid i would at least, 1
humanoid i would at least stay, 1
i would at least stay and, 1
talk to him this was what, 1
to him this was what i, 1
him this was what i was, 1
this was what i was aiming, 1
was what i was aiming to, 1
what i was aiming to do, 1
i was aiming to do with, 1
was aiming to do with the, 1
aiming to do with the centaurians, 1
when the head was done i, 1
the head was done i peeled, 1
head was done i peeled it, 1
was done i peeled it off, 1
done i peeled it off and, 1
i peeled it off and attached, 1
peeled it off and attached it, 1
it off and attached it to, 1
off and attached it to an, 1
and attached it to an attractive, 1
suit of green plastic complete with, 1
of green plastic complete with tail, 1
green plastic complete with tail i, 1
plastic complete with tail i was, 1
complete with tail i was really, 1
with tail i was really glad, 1
tail i was really glad they, 1
i was really glad they had, 1
tails the lizards didn t wear, 1
the lizards didn t wear clothes, 1
lizards didn t wear clothes and, 1
didn t wear clothes and i, 1
t wear clothes and i wanted, 1
wear clothes and i wanted to, 1
clothes and i wanted to take, 1
and i wanted to take along, 1
i wanted to take along a, 1
wanted to take along a lot, 1
of electronic equipment i built the, 1
electronic equipment i built the tail, 1
equipment i built the tail over, 1
i built the tail over a, 1
built the tail over a metal, 1
the tail over a metal frame, 1
tail over a metal frame that, 1
anchored around my waist then i, 1
around my waist then i filled, 1
my waist then i filled the, 1
waist then i filled the frame, 1
then i filled the frame with, 1
i filled the frame with all, 1
filled the frame with all the, 1
the frame with all the equipment, 1
i would need and began to, 1
would need and began to wire, 1
need and began to wire the, 1
and began to wire the suit, 1
when it was done i tried, 1
it was done i tried it, 1
was done i tried it on, 1
done i tried it on in, 1
i tried it on in front, 1
tried it on in front of, 1
it on in front of a, 1
on in front of a full, 1
in front of a full length, 1
front of a full length mirror, 1
of a full length mirror it, 1
a full length mirror it was, 1
horrible but effective the tail dragged, 1
but effective the tail dragged me, 1
effective the tail dragged me down, 1
the tail dragged me down in, 1
tail dragged me down in the, 1
dragged me down in the rear, 1
me down in the rear and, 1
down in the rear and gave, 1
in the rear and gave me, 1
a duck waddle but that only, 1
duck waddle but that only helped, 1
waddle but that only helped the, 1
but that only helped the resemblance, 1
that night i took the ship, 1
night i took the ship down, 1
i took the ship down into, 1
took the ship down into the, 1
the ship down into the hills, 1
ship down into the hills nearest, 1
down into the hills nearest the, 1
into the hills nearest the pyramid, 1
the hills nearest the pyramid an, 1
out of the way dry spot, 1
of the way dry spot where, 1
the way dry spot where the, 1
way dry spot where the amphibious, 1
dry spot where the amphibious natives, 1
spot where the amphibious natives would, 1
where the amphibious natives would never, 1
the amphibious natives would never go, 1
amphibious natives would never go a, 1
little before dawn the eye hooked, 1
before dawn the eye hooked onto, 1
dawn the eye hooked onto my, 1
the eye hooked onto my shoulders, 1
eye hooked onto my shoulders and, 1
hooked onto my shoulders and we, 1
onto my shoulders and we sailed, 1
straight up we hovered above the, 1
up we hovered above the temple, 1
we hovered above the temple at, 1
hovered above the temple at about, 1
above the temple at about meters, 1
the temple at about meters until, 1
temple at about meters until it, 1
was light then dropped straight down, 1
it must have been a grand, 1
must have been a grand sight, 1
have been a grand sight the, 1
been a grand sight the eye, 1
a grand sight the eye was, 1
grand sight the eye was camouflaged, 1
sight the eye was camouflaged to, 1
the eye was camouflaged to look, 1
eye was camouflaged to look like, 1
was camouflaged to look like a, 1
flying lizard sort of a cardboard, 1
lizard sort of a cardboard pterodactyl, 1
sort of a cardboard pterodactyl and, 1
of a cardboard pterodactyl and the, 1
a cardboard pterodactyl and the slowly, 1
cardboard pterodactyl and the slowly flapping, 1
wings obviously had nothing to do, 1
obviously had nothing to do with, 1
had nothing to do with our, 1
nothing to do with our flight, 1
to do with our flight but, 1
do with our flight but it, 1
with our flight but it was, 1
our flight but it was impressive, 1
enough for the natives the first, 1
for the natives the first one, 1
the natives the first one that, 1
natives the first one that spotted, 1
the first one that spotted me, 1
first one that spotted me screamed, 1
one that spotted me screamed and, 1
dropped over on his back the, 1
over on his back the others, 1
on his back the others came, 1
his back the others came running, 1
back the others came running they, 1
the others came running they milled, 1
others came running they milled and, 1
mobbed and piled on top of, 1
and piled on top of one, 1
piled on top of one another, 1
on top of one another and, 1
top of one another and by, 1
of one another and by that, 1
one another and by that time, 1
another and by that time i, 1
and by that time i had, 1
by that time i had landed, 1
that time i had landed in, 1
the plaza fronting the temple the, 1
plaza fronting the temple the priesthood, 1
fronting the temple the priesthood arrived, 1
i folded my arms in a, 1
folded my arms in a regal, 1
my arms in a regal stance, 1
arms in a regal stance greetings, 1
in a regal stance greetings o, 1
a regal stance greetings o noble, 1
regal stance greetings o noble servers, 1
stance greetings o noble servers of, 1
greetings o noble servers of the, 1
great god i said of course, 1
god i said of course i, 1
i said of course i didn, 1
said of course i didn t, 1
of course i didn t say, 1
course i didn t say it, 1
i didn t say it out, 1
didn t say it out loud, 1
t say it out loud just, 1
say it out loud just whispered, 1
loud enough for the throat mike, 1
enough for the throat mike to, 1
for the throat mike to catch, 1
the throat mike to catch this, 1
throat mike to catch this was, 1
mike to catch this was radioed, 1
to catch this was radioed back, 1
catch this was radioed back to, 1
this was radioed back to the, 1
mt and the translation shot back, 1
and the translation shot back to, 1
the translation shot back to a, 1
translation shot back to a speaker, 1
shot back to a speaker in, 1
back to a speaker in my, 1
to a speaker in my jaws, 1
the natives chomped and rattled and, 1
natives chomped and rattled and the, 1
chomped and rattled and the translation, 1
and rattled and the translation rolled, 1
rattled and the translation rolled out, 1
and the translation rolled out almost, 1
instantly i had the volume turned, 1
i had the volume turned up, 1
had the volume turned up and, 1
the volume turned up and the, 1
volume turned up and the whole, 1
turned up and the whole square, 1
up and the whole square echoed, 1
some of the more credulous natives, 1
of the more credulous natives prostrated, 1
the more credulous natives prostrated themselves, 1
more credulous natives prostrated themselves and, 1
credulous natives prostrated themselves and others, 1
natives prostrated themselves and others fled, 1
screaming one doubtful type raised a, 1
one doubtful type raised a spear, 1
doubtful type raised a spear but, 1
type raised a spear but no, 1
raised a spear but no one, 1
a spear but no one else, 1
spear but no one else tried, 1
but no one else tried that, 1
after the pterodactyl eye picked him, 1
the pterodactyl eye picked him up, 1
pterodactyl eye picked him up and, 1
eye picked him up and dropped, 1
picked him up and dropped him, 1
him up and dropped him in, 1
up and dropped him in the, 1
and dropped him in the swamp, 1
the priests were a hard headed, 1
priests were a hard headed lot, 1
were a hard headed lot and, 1
a hard headed lot and weren, 1
hard headed lot and weren t, 1
headed lot and weren t buying, 1
lot and weren t buying any, 1
and weren t buying any lizards, 1
weren t buying any lizards in, 1
t buying any lizards in a, 1
poke they just stood and muttered, 1
they just stood and muttered i, 1
just stood and muttered i had, 1
stood and muttered i had to, 1
and muttered i had to take, 1
muttered i had to take the, 1
i had to take the offensive, 1
had to take the offensive again, 1
begone o faithful steed i said, 1
o faithful steed i said to, 1
faithful steed i said to the, 1
steed i said to the eye, 1
i said to the eye and, 1
said to the eye and pressed, 1
to the eye and pressed the, 1
the eye and pressed the control, 1
in my palm at the same, 1
my palm at the same time, 1
it took off straight up a, 1
took off straight up a bit, 1
off straight up a bit faster, 1
straight up a bit faster than, 1
up a bit faster than i, 1
a bit faster than i wanted, 1
bit faster than i wanted little, 1
faster than i wanted little pieces, 1
than i wanted little pieces of, 1
wind torn plastic rained down while, 1
torn plastic rained down while the, 1
plastic rained down while the crowd, 1
rained down while the crowd was, 1
down while the crowd was ogling, 1
while the crowd was ogling this, 1
the crowd was ogling this ascent, 1
crowd was ogling this ascent i, 1
i would talk with you o, 1
would talk with you o noble, 1
talk with you o noble priests, 1
with you o noble priests i, 1
you o noble priests i said, 1
before they could think up a, 1
they could think up a good, 1
could think up a good answer, 1
think up a good answer i, 1
up a good answer i was, 1
a good answer i was inside, 1
the temple was a small one, 1
temple was a small one built, 1
was a small one built against, 1
a small one built against the, 1
small one built against the base, 1
one built against the base of, 1
built against the base of the, 1
against the base of the pyramid, 1
the base of the pyramid i, 1
hoped i wasn t breaking too, 1
i wasn t breaking too many, 1
wasn t breaking too many taboos, 1
t breaking too many taboos by, 1
breaking too many taboos by going, 1
too many taboos by going in, 1
many taboos by going in i, 1
taboos by going in i wasn, 1
by going in i wasn t, 1
going in i wasn t stopped, 1
so it looked all right the, 1
it looked all right the temple, 1
looked all right the temple was, 1
all right the temple was a, 1
right the temple was a single, 1
the temple was a single room, 1
temple was a single room with, 1
was a single room with a, 1
murky looking pool at one end, 1
looking pool at one end sloshing, 1
pool at one end sloshing in, 1
at one end sloshing in the, 1
one end sloshing in the pool, 1
end sloshing in the pool was, 1
sloshing in the pool was an, 1
in the pool was an ancient, 1
reptile who clearly was one of, 1
who clearly was one of the, 1
clearly was one of the leaders, 1
was one of the leaders i, 1
one of the leaders i waddled, 1
of the leaders i waddled toward, 1
the leaders i waddled toward him, 1
leaders i waddled toward him and, 1
i waddled toward him and he, 1
gave me a cold and fishy, 1
me a cold and fishy eye, 1
a cold and fishy eye then, 1
cold and fishy eye then growled, 1
and fishy eye then growled something, 1
the mt whispered into my ear, 1
mt whispered into my ear just, 1
whispered into my ear just what, 1
into my ear just what in, 1
my ear just what in the, 1
ear just what in the name, 1
just what in the name of, 1
what in the name of the, 1
in the name of the thirteenth, 1
sin are you and what are, 1
are you and what are you, 1
you and what are you doing, 1
and what are you doing here, 1
i drew up my scaly figure, 1
drew up my scaly figure in, 1
up my scaly figure in a, 1
my scaly figure in a noble, 1
scaly figure in a noble gesture, 1
figure in a noble gesture and, 1
in a noble gesture and pointed, 1
a noble gesture and pointed toward, 1
noble gesture and pointed toward the, 1
ceiling i come from your ancestors, 1
i come from your ancestors to, 1
come from your ancestors to help, 1
from your ancestors to help you, 1
your ancestors to help you i, 1
ancestors to help you i am, 1
to help you i am here, 1
help you i am here to, 1
you i am here to restore, 1
this raised a buzz of conversation, 1
raised a buzz of conversation behind, 1
a buzz of conversation behind me, 1
buzz of conversation behind me but, 1
of conversation behind me but got, 1
conversation behind me but got no, 1
behind me but got no rise, 1
me but got no rise out, 1
but got no rise out of, 1
got no rise out of the, 1
chief he sank slowly into the, 1
he sank slowly into the water, 1
sank slowly into the water until, 1
slowly into the water until only, 1
into the water until only his, 1
the water until only his eyes, 1
water until only his eyes were, 1
until only his eyes were showing, 1
only his eyes were showing i, 1
could almost hear the wheels turning, 1
almost hear the wheels turning behind, 1
hear the wheels turning behind that, 1
the wheels turning behind that moss, 1
wheels turning behind that moss covered, 1
turning behind that moss covered forehead, 1
then he lunged up and pointed, 1
he lunged up and pointed a, 1
lunged up and pointed a dripping, 1
up and pointed a dripping finger, 1
and pointed a dripping finger at, 1
pointed a dripping finger at me, 1
you are a liar you are, 1
are a liar you are no, 1
a liar you are no ancestor, 1
liar you are no ancestor of, 1
you are no ancestor of ours, 1
are no ancestor of ours we, 1
no ancestor of ours we will, 1
stop i thundered before he got, 1
i thundered before he got so, 1
thundered before he got so far, 1
before he got so far in, 1
he got so far in that, 1
got so far in that he, 1
so far in that he couldn, 1
far in that he couldn t, 1
in that he couldn t back, 1
that he couldn t back out, 1
i said your ancestors sent me, 1
said your ancestors sent me as, 1
your ancestors sent me as emissary, 1
ancestors sent me as emissary i, 1
sent me as emissary i am, 1
me as emissary i am not, 1
as emissary i am not one, 1
emissary i am not one of, 1
i am not one of your, 1
ancestors do not try to harm, 1
do not try to harm me, 1
not try to harm me or, 1
try to harm me or the, 1
to harm me or the wrath, 1
harm me or the wrath of, 1
me or the wrath of those, 1
or the wrath of those who, 1
the wrath of those who have, 1
wrath of those who have passed, 1
when i said this i turned, 1
i said this i turned to, 1
said this i turned to jab, 1
this i turned to jab a, 1
i turned to jab a claw, 1
turned to jab a claw at, 1
to jab a claw at the, 1
jab a claw at the other, 1
a claw at the other priests, 1
claw at the other priests using, 1
at the other priests using the, 1
motion to cover my flicking a, 1
to cover my flicking a coin, 1
cover my flicking a coin grenade, 1
my flicking a coin grenade toward, 1
flicking a coin grenade toward them, 1
a coin grenade toward them it, 1
coin grenade toward them it blew, 1
grenade toward them it blew a, 1
toward them it blew a nice, 1
hole in the floor with a, 1
in the floor with a great, 1
the floor with a great show, 1
floor with a great show of, 1
with a great show of noise, 1
a great show of noise and, 1
great show of noise and smoke, 1
the first lizard knew i was, 1
first lizard knew i was talking, 1
lizard knew i was talking sense, 1
knew i was talking sense then, 1
