6-gram, count
chance of breaking through near some, 1
of breaking through near some star, 1
than spend time just barreling through, 1
spend time just barreling through normal, 1
time just barreling through normal space, 1
just barreling through normal space but, 1
barreling through normal space but apparently, 1
through normal space but apparently tech, 1
knows this too they had a, 1
this too they had a safety, 1
too they had a safety factor, 1
they had a safety factor built, 1
had a safety factor built into, 1
a safety factor built into the, 1
safety factor built into the computer, 1
factor built into the computer so, 1
built into the computer so you, 1
couldn t end up inside a, 1
t end up inside a star, 1
end up inside a star no, 1
up inside a star no matter, 1
inside a star no matter how, 1
a star no matter how hard, 1
star no matter how hard you, 1
no matter how hard you tried, 1
matter how hard you tried i, 1
how hard you tried i m, 1
hard you tried i m sure, 1
there was no humaneness in this, 1
was no humaneness in this decision, 1
no humaneness in this decision they, 1
humaneness in this decision they just, 1
in this decision they just didn, 1
this decision they just didn t, 1
decision they just didn t want, 1
they just didn t want to, 1
just didn t want to lose, 1
it was a twenty hour jump, 1
was a twenty hour jump ship, 1
a twenty hour jump ship s, 1
twenty hour jump ship s time, 1
hour jump ship s time and, 1
jump ship s time and i, 1
ship s time and i came, 1
s time and i came through, 1
time and i came through in, 1
and i came through in the, 1
i came through in the middle, 1
of nowhere the robot analyzer chuckled, 1
nowhere the robot analyzer chuckled to, 1
the robot analyzer chuckled to itself, 1
robot analyzer chuckled to itself and, 1
analyzer chuckled to itself and scanned, 1
chuckled to itself and scanned all, 1
to itself and scanned all the, 1
stars comparing them to the spectra, 1
comparing them to the spectra of, 1
them to the spectra of proxima, 1
to the spectra of proxima centauri, 1
the spectra of proxima centauri it, 1
spectra of proxima centauri it finally, 1
rang a bell and blinked a, 1
a bell and blinked a light, 1
bell and blinked a light i, 1
and blinked a light i peeped, 1
blinked a light i peeped through, 1
a light i peeped through the, 1
light i peeped through the eyepiece, 1
a fast reading with the photocell, 1
fast reading with the photocell gave, 1
reading with the photocell gave me, 1
with the photocell gave me the, 1
the photocell gave me the apparent, 1
photocell gave me the apparent magnitude, 1
gave me the apparent magnitude and, 1
me the apparent magnitude and a, 1
comparison with its absolute magnitude showed, 1
with its absolute magnitude showed its, 1
its absolute magnitude showed its distance, 1
absolute magnitude showed its distance not, 1
magnitude showed its distance not as, 1
showed its distance not as bad, 1
as i had thought a six, 1
i had thought a six week, 1
had thought a six week run, 1
thought a six week run give, 1
a six week run give or, 1
six week run give or take, 1
week run give or take a, 1
run give or take a few, 1
give or take a few days, 1
or take a few days after, 1
take a few days after feeding, 1
a course tape into the robot, 1
course tape into the robot pilot, 1
tape into the robot pilot i, 1
into the robot pilot i strapped, 1
the robot pilot i strapped into, 1
robot pilot i strapped into the, 1
pilot i strapped into the acceleration, 1
the time went fast i rebuilt, 1
time went fast i rebuilt my, 1
went fast i rebuilt my camera, 1
fast i rebuilt my camera for, 1
i rebuilt my camera for about, 1
rebuilt my camera for about the, 1
my camera for about the twentieth, 1
camera for about the twentieth time, 1
for about the twentieth time and, 1
just about finished a correspondence course, 1
about finished a correspondence course in, 1
finished a correspondence course in nucleonics, 1
a correspondence course in nucleonics most, 1
repairmen take these courses besides their, 1
take these courses besides their always, 1
these courses besides their always coming, 1
courses besides their always coming in, 1
besides their always coming in handy, 1
their always coming in handy the, 1
company grades your pay by the, 1
grades your pay by the number, 1
your pay by the number of, 1
pay by the number of specialties, 1
by the number of specialties you, 1
the number of specialties you can, 1
number of specialties you can handle, 1
of specialties you can handle all, 1
this with some oil painting and, 1
with some oil painting and free, 1
some oil painting and free fall, 1
oil painting and free fall workouts, 1
painting and free fall workouts in, 1
and free fall workouts in the, 1
free fall workouts in the gym, 1
fall workouts in the gym passed, 1
the time i was asleep when, 1
time i was asleep when the, 1
i was asleep when the alarm, 1
was asleep when the alarm went, 1
asleep when the alarm went off, 1
when the alarm went off that, 1
the alarm went off that announced, 1
alarm went off that announced planetary, 1
planet two where the beacon was, 1
two where the beacon was situated, 1
where the beacon was situated according, 1
the beacon was situated according to, 1
beacon was situated according to the, 1
was situated according to the old, 1
situated according to the old charts, 1
was a mushy looking wet kind, 1
a mushy looking wet kind of, 1
mushy looking wet kind of globe, 1
looking wet kind of globe i, 1
wet kind of globe i tried, 1
kind of globe i tried to, 1
of globe i tried to make, 1
globe i tried to make sense, 1
i tried to make sense out, 1
tried to make sense out of, 1
the ancient directions and finally located, 1
ancient directions and finally located the, 1
directions and finally located the right, 1
and finally located the right area, 1
finally located the right area staying, 1
outside the atmosphere i sent a, 1
the atmosphere i sent a flying, 1
atmosphere i sent a flying eye, 1
i sent a flying eye down, 1
sent a flying eye down to, 1
a flying eye down to look, 1
flying eye down to look things, 1
eye down to look things over, 1
down to look things over in, 1
this business you learn early when, 1
business you learn early when and, 1
you learn early when and where, 1
learn early when and where to, 1
early when and where to risk, 1
when and where to risk your, 1
and where to risk your own, 1
where to risk your own skin, 1
to risk your own skin the, 1
eye would be good enough for, 1
would be good enough for the, 1
be good enough for the preliminary, 1
good enough for the preliminary survey, 1
the old boys had enough brains, 1
old boys had enough brains to, 1
boys had enough brains to choose, 1
had enough brains to choose a, 1
enough brains to choose a traceable, 1
brains to choose a traceable site, 1
to choose a traceable site for, 1
choose a traceable site for the, 1
beacon equidistant on a line between, 1
equidistant on a line between two, 1
on a line between two of, 1
a line between two of the, 1
line between two of the most, 1
between two of the most prominent, 1
two of the most prominent mountain, 1
peaks i located the peaks easily, 1
i located the peaks easily enough, 1
located the peaks easily enough and, 1
the peaks easily enough and started, 1
peaks easily enough and started the, 1
easily enough and started the eye, 1
enough and started the eye out, 1
and started the eye out from, 1
the first peak and kept it, 1
first peak and kept it on, 1
peak and kept it on a, 1
and kept it on a course, 1
kept it on a course directly, 1
it on a course directly toward, 1
on a course directly toward the, 1
a course directly toward the second, 1
course directly toward the second there, 1
was a nose and tail radar, 1
a nose and tail radar in, 1
nose and tail radar in the, 1
and tail radar in the eye, 1
tail radar in the eye and, 1
radar in the eye and i, 1
in the eye and i fed, 1
the eye and i fed their, 1
eye and i fed their signals, 1
and i fed their signals into, 1
i fed their signals into a, 1
scope as an amplitude curve when, 1
as an amplitude curve when the, 1
an amplitude curve when the two, 1
amplitude curve when the two peaks, 1
curve when the two peaks coincided, 1
when the two peaks coincided i, 1
the two peaks coincided i spun, 1
two peaks coincided i spun the, 1
eye controls and dived the thing, 1
controls and dived the thing down, 1
i cut out the radar and, 1
cut out the radar and cut, 1
out the radar and cut in, 1
the radar and cut in the, 1
radar and cut in the nose, 1
and cut in the nose orthicon, 1
cut in the nose orthicon and, 1
in the nose orthicon and sat, 1
the nose orthicon and sat back, 1
nose orthicon and sat back to, 1
orthicon and sat back to watch, 1
the beacon appear on the screen, 1
the image blinked focused and a, 1
image blinked focused and a great, 1
blinked focused and a great damn, 1
focused and a great damn pyramid, 1
and a great damn pyramid swam, 1
a great damn pyramid swam into, 1
great damn pyramid swam into view, 1
damn pyramid swam into view i, 1
cursed and wheeled the eye in, 1
and wheeled the eye in circles, 1
wheeled the eye in circles scanning, 1
the eye in circles scanning the, 1
eye in circles scanning the surrounding, 1
in circles scanning the surrounding country, 1
it was flat marshy bottom land, 1
was flat marshy bottom land without, 1
flat marshy bottom land without a, 1
marshy bottom land without a bump, 1
bottom land without a bump the, 1
land without a bump the only, 1
without a bump the only thing, 1
a bump the only thing in, 1
bump the only thing in a, 1
ten mile circle was this pyramid, 1
mile circle was this pyramid and, 1
circle was this pyramid and that, 1
was this pyramid and that definitely, 1
this pyramid and that definitely wasn, 1
pyramid and that definitely wasn t, 1
and that definitely wasn t my, 1
that definitely wasn t my beacon, 1
i dived the eye lower the, 1
dived the eye lower the pyramid, 1
the eye lower the pyramid was, 1
eye lower the pyramid was a, 1
lower the pyramid was a crude, 1
the pyramid was a crude looking, 1
pyramid was a crude looking thing, 1
was a crude looking thing of, 1
undressed stone without carvings or decorations, 1
stone without carvings or decorations there, 1
without carvings or decorations there was, 1
carvings or decorations there was a, 1
or decorations there was a shimmer, 1
decorations there was a shimmer of, 1
light from the top and i, 1
from the top and i took, 1
the top and i took a, 1
top and i took a closer, 1
and i took a closer look, 1
i took a closer look at, 1
took a closer look at it, 1
a closer look at it on, 1
closer look at it on the, 1
look at it on the peak, 1
at it on the peak of, 1
it on the peak of the, 1
pyramid was a hollow basin filled, 1
was a hollow basin filled with, 1
a hollow basin filled with water, 1
hollow basin filled with water when, 1
basin filled with water when i, 1
filled with water when i saw, 1
with water when i saw that, 1
water when i saw that something, 1
locking the eye in a circular, 1
the eye in a circular course, 1
eye in a circular course i, 1
in a circular course i dug, 1
a circular course i dug through, 1
circular course i dug through the, 1
course i dug through the mark, 1
i dug through the mark iii, 1
plans and there it was the, 1
and there it was the beacon, 1
there it was the beacon had, 1
it was the beacon had a, 1
was the beacon had a precipitating, 1
the beacon had a precipitating field, 1
beacon had a precipitating field and, 1
had a precipitating field and a, 1
basin on top of it for, 1
on top of it for water, 1
top of it for water this, 1
of it for water this was, 1
it for water this was used, 1
for water this was used to, 1
water this was used to cool, 1
this was used to cool the, 1
was used to cool the reactor, 1
used to cool the reactor that, 1
powered the monstrosity if the water, 1
the monstrosity if the water was, 1
monstrosity if the water was still, 1
if the water was still there, 1
the water was still there the, 1
water was still there the beacon, 1
was still there the beacon was, 1
still there inside the pyramid the, 1
there inside the pyramid the natives, 1
inside the pyramid the natives who, 1
the pyramid the natives who of, 1
pyramid the natives who of course, 1
the natives who of course weren, 1
natives who of course weren t, 1
even mentioned by the idiots who, 1
mentioned by the idiots who constructed, 1
by the idiots who constructed the, 1
the idiots who constructed the thing, 1
idiots who constructed the thing had, 1
who constructed the thing had built, 1
constructed the thing had built a, 1
the thing had built a nice, 1
heavy thick stone pyramid around the, 1
thick stone pyramid around the beacon, 1
i took another look at the, 1
took another look at the screen, 1
another look at the screen and, 1
look at the screen and realized, 1
at the screen and realized that, 1
the screen and realized that i, 1
screen and realized that i had, 1
and realized that i had locked, 1
realized that i had locked the, 1
that i had locked the eye, 1
into a circular orbit about twenty, 1
a circular orbit about twenty feet, 1
circular orbit about twenty feet above, 1
orbit about twenty feet above the, 1
about twenty feet above the pyramid, 1
twenty feet above the pyramid the, 1
feet above the pyramid the summit, 1
above the pyramid the summit of, 1
the stone pile was now covered, 1
stone pile was now covered with, 1
pile was now covered with lizards, 1
was now covered with lizards of, 1
now covered with lizards of some, 1
covered with lizards of some type, 1
with lizards of some type apparently, 1
lizards of some type apparently the, 1
local life form they had what, 1
life form they had what looked, 1
form they had what looked like, 1
they had what looked like throwing, 1
had what looked like throwing sticks, 1
what looked like throwing sticks and, 1
looked like throwing sticks and arbalasts, 1
and were trying to shoot down, 1
were trying to shoot down the, 1
trying to shoot down the eye, 1
to shoot down the eye a, 1
shoot down the eye a cloud, 1
down the eye a cloud of, 1
the eye a cloud of arrows, 1
eye a cloud of arrows and, 1
a cloud of arrows and rocks, 1
i pulled the eye straight up, 1
pulled the eye straight up and, 1
the eye straight up and away, 1
eye straight up and away and, 1
straight up and away and threw, 1
up and away and threw in, 1
and away and threw in the, 1
away and threw in the control, 1
and threw in the control circuit, 1
that would return it automatically to, 1
would return it automatically to the, 1
return it automatically to the ship, 1
then i went to the galley, 1
i went to the galley for, 1
went to the galley for a, 1
to the galley for a long, 1
the galley for a long strong, 1
galley for a long strong drink, 1
for a long strong drink my, 1
a long strong drink my beacon, 1
long strong drink my beacon was, 1
strong drink my beacon was not, 1
only locked inside a mountain of, 1
locked inside a mountain of handmade, 1
inside a mountain of handmade stone, 1
a mountain of handmade stone but, 1
mountain of handmade stone but i, 1
of handmade stone but i had, 1
handmade stone but i had managed, 1
stone but i had managed to, 1
irritate the things who had built, 1
the things who had built the, 1
things who had built the pyramid, 1
who had built the pyramid a, 1
had built the pyramid a great, 1
built the pyramid a great beginning, 1
the pyramid a great beginning for, 1
pyramid a great beginning for a, 1
job and one clearly designed to, 1
and one clearly designed to drive, 1
one clearly designed to drive a, 1
clearly designed to drive a stronger, 1
designed to drive a stronger man, 1
to drive a stronger man than, 1
drive a stronger man than me, 1
a stronger man than me to, 1
stronger man than me to the, 1
normally a repairman stays away from, 1
a repairman stays away from native, 1
repairman stays away from native cultures, 1
stays away from native cultures they, 1
away from native cultures they are, 1
from native cultures they are poison, 1
anthropologists may not mind being dissected, 1
may not mind being dissected for, 1
not mind being dissected for their, 1
mind being dissected for their science, 1
being dissected for their science but, 1
dissected for their science but a, 1
repairman wants to make no sacrifices, 1
wants to make no sacrifices of, 1
to make no sacrifices of any, 1
make no sacrifices of any kind, 1
no sacrifices of any kind for, 1
sacrifices of any kind for his, 1
of any kind for his job, 1
any kind for his job for, 1
kind for his job for this, 1
reason most beacons are built on, 1
most beacons are built on uninhabited, 1
beacons are built on uninhabited planets, 1
are built on uninhabited planets if, 1
built on uninhabited planets if a, 1
on uninhabited planets if a beacon, 1
uninhabited planets if a beacon has, 1
to go on a planet with, 1
go on a planet with a, 1
on a planet with a culture, 1
a planet with a culture it, 1
planet with a culture it is, 1
with a culture it is usually, 1
a culture it is usually built, 1
culture it is usually built in, 1
it is usually built in some, 1
why this beacon had been built, 1
this beacon had been built within, 1
beacon had been built within reach, 1
had been built within reach of, 1
been built within reach of the, 1
built within reach of the local, 1
within reach of the local claws, 1
reach of the local claws i, 1
of the local claws i had, 1
yet to find out but that, 1
to find out but that would, 1
find out but that would come, 1
out but that would come in, 1
but that would come in time, 1
that would come in time the, 1
would come in time the first, 1
come in time the first thing, 1
in time the first thing to, 1
time the first thing to do, 1
the first thing to do was, 1
make contact to make contact you, 1
contact to make contact you have, 1
to make contact you have to, 1
make contact you have to know, 1
contact you have to know the, 1
you have to know the local, 1
have to know the local language, 1
and for that i had long, 1
for that i had long before, 1
that i had long before worked, 1
i had long before worked out, 1
had long before worked out a, 1
long before worked out a system, 1
before worked out a system that, 1
worked out a system that was, 1
i had a pryeye of my, 1
had a pryeye of my own, 1
a pryeye of my own construction, 1
pryeye of my own construction it, 1
of my own construction it looked, 1
my own construction it looked like, 1
own construction it looked like a, 1
construction it looked like a piece, 1
it looked like a piece of, 1
looked like a piece of rock, 1
about a foot long once on, 1
a foot long once on the, 1
foot long once on the ground, 1
long once on the ground it, 1
once on the ground it would, 1
on the ground it would never, 1
the ground it would never be, 1
ground it would never be noticed, 1
it would never be noticed though, 1
it was a little disconcerting to, 1
was a little disconcerting to see, 1
a little disconcerting to see it, 1
little disconcerting to see it float, 1
disconcerting to see it float by, 1
to see it float by i, 1
see it float by i located, 1
it float by i located a, 1
float by i located a lizard, 1
town about a thousand kilometers from, 1
about a thousand kilometers from the, 1
a thousand kilometers from the pyramid, 1
thousand kilometers from the pyramid and, 1
kilometers from the pyramid and dropped, 1
from the pyramid and dropped the, 1
the pyramid and dropped the eye, 1
it swished down and landed at, 1
swished down and landed at night, 1
down and landed at night in, 1
and landed at night in the, 1
landed at night in the bank, 1
at night in the bank of, 1
night in the bank of the, 1
in the bank of the local, 1
the bank of the local mud, 1
bank of the local mud wallow, 1
this was a favorite spot that, 1
was a favorite spot that drew, 1
a favorite spot that drew a, 1
favorite spot that drew a good, 1
spot that drew a good crowd, 1
that drew a good crowd during, 1
drew a good crowd during the, 1
a good crowd during the day, 1
good crowd during the day in, 1
crowd during the day in the, 1
morning when the first wallowers arrived, 1
when the first wallowers arrived i, 1
the first wallowers arrived i flipped, 1
first wallowers arrived i flipped on, 1
wallowers arrived i flipped on the, 1
arrived i flipped on the recorder, 1
after about five of the local, 1
about five of the local days, 1
five of the local days i, 1
of the local days i had, 1
the local days i had a, 1
local days i had a sea, 1
days i had a sea of, 1
i had a sea of native, 1
had a sea of native conversation, 1
in the memory bank of the, 1
the memory bank of the machine, 1
memory bank of the machine translator, 1
bank of the machine translator and, 1
of the machine translator and had, 1
the machine translator and had tagged, 1
machine translator and had tagged a, 1
translator and had tagged a few, 1
expressions this is fairly easy to, 1
this is fairly easy to do, 1
is fairly easy to do when, 1
fairly easy to do when you, 1
easy to do when you have, 1
to do when you have a, 1
do when you have a machine, 1
when you have a machine memory, 1
you have a machine memory to, 1
work with one of the lizards, 1
with one of the lizards gargled, 1
one of the lizards gargled at, 1
of the lizards gargled at another, 1
the lizards gargled at another one, 1
lizards gargled at another one and, 1
gargled at another one and the, 1
at another one and the second, 1
another one and the second one, 1
turned around i tagged this expression, 1
around i tagged this expression with, 1
i tagged this expression with the, 1
tagged this expression with the phrase, 1
this expression with the phrase hey, 1
expression with the phrase hey george, 1
and waited my chance to use, 1
waited my chance to use it, 1
my chance to use it later, 1
chance to use it later the, 1
to use it later the same, 1
use it later the same day, 1
it later the same day i, 1
later the same day i caught, 1
the same day i caught one, 1
same day i caught one of, 1
day i caught one of them, 1
alone and shouted hey george at, 1
and shouted hey george at him, 1
shouted hey george at him it, 1
hey george at him it gurgled, 1
george at him it gurgled out, 1
at him it gurgled out through, 1
him it gurgled out through the, 1
speaker in the local tongue and, 1
in the local tongue and he, 1
the local tongue and he turned, 1
local tongue and he turned around, 1
when you get enough reference phrases, 1
you get enough reference phrases like, 1
get enough reference phrases like this, 1
enough reference phrases like this in, 1
reference phrases like this in the, 1
phrases like this in the memory, 1
like this in the memory bank, 1
this in the memory bank the, 1
mt brain takes over and starts, 1
brain takes over and starts filling, 1
takes over and starts filling in, 1
over and starts filling in the, 1
and starts filling in the missing, 1
starts filling in the missing pieces, 1
filling in the missing pieces as, 1
in the missing pieces as soon, 1
the missing pieces as soon as, 1
the mt could give a running, 1
mt could give a running translation, 1
could give a running translation of, 1
give a running translation of any, 1
a running translation of any conversation, 1
running translation of any conversation it, 1
translation of any conversation it heard, 1
of any conversation it heard i, 1
figured it was time to make, 1
it was time to make a, 1
was time to make a contact, 1
i found him easily enough he, 1
found him easily enough he was, 1
him easily enough he was the, 1
easily enough he was the centaurian, 1
enough he was the centaurian version, 1
he was the centaurian version of, 1
was the centaurian version of a, 1
goat boy he herded a particularly, 1
boy he herded a particularly loathsome, 1
he herded a particularly loathsome form, 1
herded a particularly loathsome form of, 1
a particularly loathsome form of local, 1
particularly loathsome form of local life, 1
loathsome form of local life in, 1
form of local life in the, 1
swamps outside the town i had, 1
outside the town i had one, 1
the town i had one of, 1
town i had one of the, 1
i had one of the working, 1
had one of the working eyes, 1
one of the working eyes dig, 1
of the working eyes dig a, 1
the working eyes dig a cave, 1
working eyes dig a cave in, 1
eyes dig a cave in an, 1
outcropping of rock and wait for, 1
of rock and wait for him, 1
when he passed next day i, 1
he passed next day i whispered, 1
passed next day i whispered into, 1
next day i whispered into the, 1
day i whispered into the mike, 1
i whispered into the mike welcome, 1
whispered into the mike welcome o, 1
goat boy grandson this is your, 1
boy grandson this is your grandfather, 1
grandson this is your grandfather s, 1
this is your grandfather s spirit, 1
is your grandfather s spirit speaking, 1
your grandfather s spirit speaking from, 1
paradise this fitted in with what, 1
this fitted in with what i, 1
fitted in with what i could, 1
in with what i could make, 1
with what i could make out, 1
what i could make out of, 1
i could make out of the, 1
could make out of the local, 1
goat boy stopped as if he, 1
boy stopped as if he d, 1
stopped as if he d been, 1
as if he d been shot, 1
if he d been shot before, 1
he d been shot before he, 1
d been shot before he could, 1
been shot before he could move, 1
shot before he could move i, 1
before he could move i pushed, 1
he could move i pushed a, 1
switch and a handful of the, 1
and a handful of the local, 1
a handful of the local currency, 1
handful of the local currency wampum, 1
of the local currency wampum type, 1
the local currency wampum type shells, 1
local currency wampum type shells rolled, 1
out of the cave and landed, 1
of the cave and landed at, 1
the cave and landed at his, 1
cave and landed at his feet, 1
here is some money from paradise, 1
is some money from paradise because, 1
some money from paradise because you, 1
money from paradise because you have, 1
from paradise because you have been, 1
paradise because you have been a, 1
because you have been a good, 1
you have been a good boy, 1
